{
  "youtube_id": "",
  "title": "Indoor Aquarium Tour",
  "publish_date": "2025-07-01",
  "duration_seconds": 240,
  "keywords": ["aquarium", "solarpunk", "indoor", "fish", "ecology"],
  "status": "draft",
  "description": "A quick walk-through of my four indoor aquariums and the tech keeping them thriving."
} 