{
  "youtube_id": "",
  "title": "Indoor Aquarium Tour",
  "publish_date": "2025-10-01",
  "duration_seconds": 240,
  "keywords": [
    "aquarium",
    "guppies",
    "walstad",
    "betta",
    "microfauna",
    "aquaponics"
  ],
  "status": "draft",
  "description": "After four years away, Daniel tours four indoor aquariums: a Walstad guppy tank, a fry-filled 10 gallon, a cycling betta setup on a flimsy shelf, and a tiny shrimp tank. He shares maintenance tricks, microfauna struggles, and hints at automation and outdoor projects.",
  "slug": "indoor-aquariums-tour",
  "thumbnail": "thumbnails/20251001.jpg",
  "transcript_file": "",
  "summary": "Daniel showcases four indoor tanks and lessons learned.",
  "view_count": 0
}
